{
  "claimId": "CLAIM-STAT-001",
  "targetSnapshot": "seer-stat-model-multi-source",
  "mode": "battle-general",
  "statement": "六维面板推导（4399 计算解析第一期 + BWIKI 培养机制交叉验证）：体力 = Int[(2×种族值+个体值+努力值÷4)×等级÷100 + 等级+10]；其余五维 = Int[((2×种族值+个体值+努力值÷4)×等级÷100 + 5)×性格修正]。关键语义：努力值÷4 不预先取整，小数部分穿过性格乘算后在末端单次 Int（去尾，非四舍五入）——由此产生性格×努力值『省点』阈值：性格+项（×1.1）极限努力值需 254 或 255，取决于 (种族个位×2+个体个位) mod 10 ∈ {4,5,6}；中性项与体力 252 即封顶。个体值 0..31；努力值单项 0..255、总和 ≤510；性格 25 种，非体力一项 +10%、一项 -10%，体力不受性格影响。",
  "boundaries": "交叉验证来源：4399《赛尔号计算解析（第一期）》官方公式推导、BWIKI 培养机制页、4399 性格攻略。异能系数(×1.3)/刻印/称号等版本附加项不在本模型内；Lv<100 时小数参与等级缩放与原作一致（推导式连续），未对低级段单独验证。",
  "source": {
    "kind": "observation",
    "uri": "https://wiki.biligame.com/seer/ (性格/面板条目) + https://news.4399.com/seer/ (性格攻略)"
  },
  "observedAt": "2026-05-21",
  "evidenceDigest": "sha256:f7b9eeb4ee68a54f7934c66cd6907e51752abbf81277bd6bcf89e815750cdb17",
  "reviewer": "manual cross-check across BWIKI/4399/secondary guides; 25-nature table reproduced in content/rulesets/natures.json",
  "verification": "UNVERIFIED",
  "fixtureIds": []
}
